{"active_behavior_authorization":false,"adaptive_rule_derivation_authorization":false,"cells":[{"bounded_aggregate":{"application_send_batch_evidence_count":262421,"arithmetic_saturated":false,"buffer_copy_operation_count":1472394,"connection_count":4,"epoch_count":43,"oversized_committed_bytes":301465600,"oversized_write_evidence_count":4600,"owner_release_count":782977,"stdout_bytes":41827},"cell_content_sha256":"c9e070a0880872c9c9dce62f07e933a0de96c7590d343ce7f923f121278bba28","cell_id":"a0","descriptive_midpoint":{"latency_p50_ms":756.691,"latency_p95_ms":909.0355749999999,"requests_per_second":115.5339623557707,"useful_bytes_per_second":7571633.756947788},"implementation_package":{"package_id":"quic-dotnet-raw-dev","package_version":"adaptive-runtime-admission-performance-pilot-257b31f3-fc82651c-a0","sha256":"cf735c2d266415abd567b9fd4a00dfa44c3a34af42014b66addbe8deec587ffc"},"job_id":"job-a5cfa52949504a9dbdb784c0bbd812af","policy_values":{"application_send_batch_formation":"legacy_current","buffer_copy_coalescing":"legacy_current","oversized_write_admission_quantum":"legacy_current"},"repetitions":[{"bytes_received":111411200,"bytes_sent":111411200,"failed_requests":0,"latency_p50_ms":778.229,"latency_p95_ms":926.1529999999999,"load_generator_saturation_status":"load-generator-saturation-not-detected","repetition":1,"requests_per_second":112.178451686087,"successful_requests":1700,"timeout_requests":0,"total_requests":1700,"useful_bytes_per_second":7351727.009699398},{"bytes_received":117964800,"bytes_sent":117964800,"failed_requests":0,"latency_p50_ms":735.153,"latency_p95_ms":891.91815,"load_generator_saturation_status":"load-generator-saturation-not-detected","repetition":2,"requests_per_second":118.8894730254544,"successful_requests":1800,"timeout_requests":0,"total_requests":1800,"useful_bytes_per_second":7791540.504196179}],"run_id":"pilot-a0-manifest.send_admission_composition.performance.pilot.v1-quic-transport-v1-comparison-cell-1","topology":{"classification":"independent_physical_hosts","load_node_id":"plab-worker-x64-03","load_physical_host_id":"plab-worker-x64-03","sut_node_id":"plab-worker-x64-02","sut_physical_host_id":"plab-worker-x64-02"}},{"bounded_aggregate":{"application_send_batch_evidence_count":268980,"arithmetic_saturated":false,"buffer_copy_operation_count":1525246,"connection_count":4,"epoch_count":44,"oversized_committed_bytes":308019200,"oversized_write_evidence_count":4700,"owner_release_count":800909,"stdout_bytes":42775},"cell_content_sha256":"99c02f1b21aaef38b13b996a8e25d31b1e78d1f6927433470dd743ddc3a37598","cell_id":"a4","descriptive_midpoint":{"latency_p50_ms":726.1927499999999,"latency_p95_ms":902.8019750000001,"requests_per_second":118.5088099870251,"useful_bytes_per_second":7766593.371309677},"implementation_package":{"package_id":"quic-dotnet-raw-dev","package_version":"adaptive-runtime-admission-performance-pilot-257b31f3-fc82651c-a4","sha256":"298ef42f062197e4289a01b2e1c851b57b3c862cb02bebed16f8fc365af9bd79"},"job_id":"job-db808369ab2b4f9a84c9517e83cb9413","policy_values":{"application_send_batch_formation":"legacy_current","buffer_copy_coalescing":"legacy_current","oversized_write_admission_quantum":"single_fragment"},"repetitions":[{"bytes_received":117964800,"bytes_sent":117964800,"failed_requests":0,"latency_p50_ms":723.707,"latency_p95_ms":885.60785,"load_generator_saturation_status":"load-generator-saturation-not-detected","repetition":2,"requests_per_second":118.12724099336548,"successful_requests":1800,"timeout_requests":0,"total_requests":1800,"useful_bytes_per_second":7741586.8657412},{"bytes_received":117964800,"bytes_sent":117964800,"failed_requests":0,"latency_p50_ms":728.6785,"latency_p95_ms":919.9961000000001,"load_generator_saturation_status":"load-generator-saturation-not-detected","repetition":1,"requests_per_second":118.89037898068472,"successful_requests":1800,"timeout_requests":0,"total_requests":1800,"useful_bytes_per_second":7791599.8768781535}],"run_id":"pilot-a4-manifest.send_admission_composition.performance.pilot.v1-quic-transport-v1-comparison-cell-1","topology":{"classification":"independent_physical_hosts","load_node_id":"plab-worker-x64-03","load_physical_host_id":"plab-worker-x64-03","sut_node_id":"plab-worker-x64-02","sut_physical_host_id":"plab-worker-x64-02"}},{"bounded_aggregate":{"application_send_batch_evidence_count":268988,"arithmetic_saturated":false,"buffer_copy_operation_count":1496549,"connection_count":4,"epoch_count":45,"oversized_committed_bytes":308019200,"oversized_write_evidence_count":4700,"owner_release_count":800531,"stdout_bytes":43740},"cell_content_sha256":"1b7b63f5d53d39416d999b4bda0cc0c80e8817a535ceed9bc91e36aa12bcc2b1","cell_id":"a3","descriptive_midpoint":{"latency_p50_ms":741.1179999999999,"latency_p95_ms":894.4919749999999,"requests_per_second":116.37355960914334,"useful_bytes_per_second":7626657.602544818},"implementation_package":{"package_id":"quic-dotnet-raw-dev","package_version":"adaptive-runtime-admission-performance-pilot-257b31f3-fc82651c-a3","sha256":"27854455aa1b5c8a213900936eb2b0bc376239a92a781854380830dba0d980d1"},"job_id":"job-b984b2f5a2d44c06af3f58ba66a482cb","policy_values":{"application_send_batch_formation":"single_eligible","buffer_copy_coalescing":"memory_conservative","oversized_write_admission_quantum":"legacy_current"},"repetitions":[{"bytes_received":117964800,"bytes_sent":117964800,"failed_requests":0,"latency_p50_ms":736.067,"latency_p95_ms":896.06705,"load_generator_saturation_status":"load-generator-saturation-not-detected","repetition":1,"requests_per_second":117.80831621734812,"successful_requests":1800,"timeout_requests":0,"total_requests":1800,"useful_bytes_per_second":7720685.8116201265},{"bytes_received":117964800,"bytes_sent":117964800,"failed_requests":0,"latency_p50_ms":746.169,"latency_p95_ms":892.9168999999999,"load_generator_saturation_status":"load-generator-saturation-not-detected","repetition":2,"requests_per_second":114.93880300093858,"successful_requests":1800,"timeout_requests":0,"total_requests":1800,"useful_bytes_per_second":7532629.393469511}],"run_id":"pilot-a3-manifest.send_admission_composition.performance.pilot.v1-quic-transport-v1-comparison-cell-1","topology":{"classification":"independent_physical_hosts","load_node_id":"plab-worker-x64-03","load_physical_host_id":"plab-worker-x64-03","sut_node_id":"plab-worker-x64-02","sut_physical_host_id":"plab-worker-x64-02"}},{"bounded_aggregate":{"application_send_batch_evidence_count":273792,"arithmetic_saturated":false,"buffer_copy_operation_count":1500874,"connection_count":4,"epoch_count":45,"oversized_committed_bytes":314572800,"oversized_write_evidence_count":4800,"owner_release_count":817329,"stdout_bytes":43684},"cell_content_sha256":"281b32fd62406993adbffb6c6717e8a73d8ced29524b8f0a82b2d470cbda409f","cell_id":"a7","descriptive_midpoint":{"latency_p50_ms":739.51,"latency_p95_ms":882.573725,"requests_per_second":117.583364449751,"useful_bytes_per_second":7705943.372578882},"implementation_package":{"package_id":"quic-dotnet-raw-dev","package_version":"adaptive-runtime-admission-performance-pilot-257b31f3-fc82651c-a7","sha256":"737893592093a06b9916bc61148efdf3f770455749d9a5743e7cf60bb3c2f8de"},"job_id":"job-6af1962988f74b328f23d8e6066c11bf","policy_values":{"application_send_batch_formation":"single_eligible","buffer_copy_coalescing":"memory_conservative","oversized_write_admission_quantum":"single_fragment"},"repetitions":[{"bytes_received":117964800,"bytes_sent":117964800,"failed_requests":0,"latency_p50_ms":759.0535,"latency_p95_ms":898.4521,"load_generator_saturation_status":"load-generator-saturation-not-detected","repetition":1,"requests_per_second":114.61676892194278,"successful_requests":1800,"timeout_requests":0,"total_requests":1800,"useful_bytes_per_second":7511524.568068442},{"bytes_received":124518400,"bytes_sent":124518400,"failed_requests":0,"latency_p50_ms":719.9665,"latency_p95_ms":866.69535,"load_generator_saturation_status":"load-generator-saturation-not-detected","repetition":2,"requests_per_second":120.54995997755921,"successful_requests":1900,"timeout_requests":0,"total_requests":1900,"useful_bytes_per_second":7900362.1770893205}],"run_id":"pilot-a7-manifest.send_admission_composition.performance.pilot.v1-quic-transport-v1-comparison-cell-1","topology":{"classification":"independent_physical_hosts","load_node_id":"plab-worker-x64-03","load_physical_host_id":"plab-worker-x64-03","sut_node_id":"plab-worker-x64-02","sut_physical_host_id":"plab-worker-x64-02"}}],"compiled_manifest_ref":{"document_id":"manifest.send_admission_composition.performance.pilot.v1","schema_version":"adaptive-runtime-send-admission-performance-pilot-manifest-v1","document_version":1,"content_sha256":"257b31f3f93c6a34e14066b2c5d77bfc15ab5f2cfe54603b8d9244eb93fb7fd9"},"conclusion":"pilot_completed_directional_only","content_sha256":"2887fed8f5769acbd90bafaf18418f0de81ed8f969ad2c23705e422f292ff610","controller_uri":"http://10.10.99.176:5088","covering_array":{"generator_implemented":false,"required_for_current_eight_cell_family":false,"trigger_effective_cell_count":65},"directional_comparisons":[{"cell_id":"a3","classification":"directional_only","latency_p95_difference_percent":-1.599893381510396,"requests_per_second_difference_percent":0.7267103423556293,"versus_cell_id":"a0"},{"cell_id":"a4","classification":"directional_only","latency_p95_difference_percent":-0.6857377391418149,"requests_per_second_difference_percent":2.5748685240222073,"versus_cell_id":"a0"},{"cell_id":"a7","classification":"directional_only","latency_p95_difference_percent":-2.9109806841167813,"requests_per_second_difference_percent":1.7738525124495061,"versus_cell_id":"a0"}],"document_id":"adaptive_runtime_send_admission_performance_pilot_result_v1","document_version":1,"execution_manifest_ref":{"document_id":"manifest.send_admission_composition.performance.pilot.v1","schema_version":"adaptive-runtime-send-admission-performance-pilot-manifest